{"analysis_scope_digest":"7b47e00a7c7544149d5957ff918c13b3efb115665cac71774408157ecd00d8d1","artifact_kind":"RELATION_SET","canonicalization_profile":"veritrail-json-c14n/1","conflicts":[],"derivation_profile_digest":"e8bbe54140ff2a082b69d6b6967d8630a423abd135ac6e7be0badc1fe053125b","fact_set_digest":"a1caf8e57c7362649cdbe4c18a857e470bf930f4c6e07b47c95b0cf4af53e45a","policy_digest":"ba5d50b166e56a5d8ee3fd8fd56841e8008dd43196c1547840810eb3e6209c4a","relation_set_digest":"62586ad1209dec7e76dbb3af006a7e4099831cbfd149dc3114bad27d463f7d1a","relations":[{"local_ordinal":0,"provenance_refs":["56178c8b176896f6727cec8f942a7d5063caed4e422b6b34325b3b03a6dfde00"],"relation_id":"243fa6dba97154a6d6c7d712405640fb6f573573c359079b44cfb44ff7136089","relation_kind":"IMPORT_TARGET_LITERAL","relation_space":"IMPORT_EDGE","relation_subject_digest":"a77f7092282d016afbc8b2f23f70164262b20301f9da4ebb93a068a1dacd66c2","semantic_attributes":{},"source_fact_id":"7a00cb5656f706ad97b236ed0cf239dbac84400d1845d557fb4444f7c12069f8","target":{"imported_name":null,"module_parts":["pkg","mod"],"relative_level":0,"resolution_status":"RESOLVED","resolved_fact_ids":["ffbec0037c18189f6d6af2e28ababcbed60b61a299ce58d1e0ca3f1cbcf15bf7"],"target_kind":"IMPORT_LITERAL","topology_status":"IN_SNAPSHOT"}},{"local_ordinal":0,"provenance_refs":["56178c8b176896f6727cec8f942a7d5063caed4e422b6b34325b3b03a6dfde00"],"relation_id":"67665e4c89ffb97521aba6ba221ba61d098258f2a899e38f03361d7324d328ff","relation_kind":"LEXICAL_CONTAINS","relation_space":"CHILD_EDGE","relation_subject_digest":"b3816e40736e23e0cd755aab1dd97501cfc100b32b32bc90effa2615edb13324","semantic_attributes":{},"source_fact_id":"ffbec0037c18189f6d6af2e28ababcbed60b61a299ce58d1e0ca3f1cbcf15bf7","target":{"fact_id":"7a00cb5656f706ad97b236ed0cf239dbac84400d1845d557fb4444f7c12069f8","target_kind":"FACT"}}],"schema_version":"0.1","source_snapshot_digest":"3acb02f99805fd684ff68a1e0d2a2e24a22d75232564a1f52646c89e4398f747"}
